CPU: ID 0x906c0, Processor Type 0x0, Family 0x6, Model 0x9c, Stepping 0x0
Northbridge: 8086:4e24 (unknown)
Southbridge: 8086:4d87 (Jasper Lake)
IGD: 8086:4e61 (unknown)
SBREG_BAR = 0xfd000000 (MEM)


============= GPIOS =============

------- GPIO Community 0 -------

PCR Port ID: 0x690000

------- GPIO Group GPP_G -------
0x0600: 0x0000001844000300 GPP_G00      GPIO                
0x0610: 0x0000001944000300 GPP_G01      GPIO                
0x0620: 0x0000001a44000300 GPP_G02      GPIO                
0x0630: 0x0000001b44000300 GPP_G03      GPIO                
0x0640: 0x0000001c44000300 GPP_G04      GPIO                
0x0650: 0x0000001d44000300 GPP_G05      GPIO                
0x0660: 0x0000001e44000300 GPP_G06      GPIO                
0x0670: 0x0000001f44000300 GPP_G07      GPIO                
------- GPIO Community 1 -------

PCR Port ID: 0x6a0000

------- GPIO Group HVCMOS -------
0x0600: 0x0000000040000700 L_BKLTEN     L_BKLTEN            
0x0610: 0x0000000040000700 L_BKLTCTL    L_BKLTCTL           
0x0620: 0x0000000040000700 LVDDEN       LVDDEN              
0x0630: 0x0000000040000702 SYS_PWROK    SYS_PWROK           
0x0640: 0x0000000040000702 SYS_RESETB   SYS_RESETB          
0x0650: 0x0000000040000700 MLK_RSTB     MLK_RSTB            
------- GPIO Group GPP_E -------
0x0660: 0x0000007244000300 GPP_E00      GPIO                
0x0670: 0x0000007384000201 GPP_E01      GPIO                
0x0680: 0x0000007444000300 GPP_E02      GPIO                
0x0690: 0x0000007544000300 GPP_E03      GPIO                
0x06a0: 0x0000007644000300 GPP_E04      GPIO                
0x06b0: 0x0000007744000700 GPP_E05      SATA_LED_N          
0x06c0: 0x0000001844000300 GPP_E06      GPIO                
0x06d0: 0x0000001944000300 GPP_E07      GPIO                
0x06e0: 0x0000001a40880102 GPP_E08      GPIO                
0x06f0: 0x0000001b04000b02 GPP_E09      SML_CLK0            
0x0700: 0x0000001c04000b02 GPP_E10      SML_DATA0           
0x0710: 0x00003c1d44000300 GPP_E11      GPIO                
0x0720: 0x00003c1e44000300 GPP_E12      GPIO                
0x0730: 0x00003c1f44001700 GPP_E13      BSSB_LS0_RX         
0x0740: 0x00003c2044001700 GPP_E14      BSSB_LS0_TX         
0x0750: 0x00003c2144000700 GPP_E15      DDI1_DDC_SCL        
0x0760: 0x00003c2244000702 GPP_E16      DDI1_DDC_SDA        
0x0770: 0x00003c2344000700 GPP_E17      DDI2_DDC_SCL        
0x0780: 0x00003c2444000702 GPP_E18      DDI2_DDC_SDA        
0x0790: 0x0000002544000a00 GPP_E19      Reserved            
0x07a0: 0x0000002644000700 GPP_E20      CNV_BRI_DT          
0x07b0: 0x0000302744000602 GPP_E21      CNV_BRI_RSP         
0x07c0: 0x0000002844000700 GPP_E22      CNV_RGI_DT          
0x07d0: 0x0000302944000602 GPP_E23      CNV_RGI_RSP         
------- GPIO Group JTAG -------
0x07e0: 0x00003c0040000702 JTAG_TD0     JTAG_TD0            
0x07f0: 0x00003c0040000700 JTAGX        JTAGX               
0x0800: 0x00003c0040000702 PRDYB        PRDYB               
0x0810: 0x00003c0040000702 PREQB        PREQB               
0x0820: 0x00003c0040000700 CPU_TRSTB    CPU_TRSTB           
0x0830: 0x00003c0040000702 JTAG_TDI     JTAG_TDI            
0x0840: 0x00003c0040000702 JTAG_TMS     JTAG_TMS            
0x0850: 0x00003c0040000700 JTAG_TCK     JTAG_TCK            
0x0860: 0x00003c0040000700 ITP_PMODE    ITP_PMODE           
------- GPIO Group VGPIO_LNK -------
0x0870: 0x0000000040000400 VGPIO_LNK_DN_0 VGPIO_LNK_DN_0      
0x0880: 0x0000000040000400 VGPIO_LNK_DN_1 VGPIO_LNK_DN_1      
0x0890: 0x0000000040000400 VGPIO_LNK_DN_2 VGPIO_LNK_DN_2      
0x08a0: 0x0000000040000400 VGPIO_LNK_DN_3 VGPIO_LNK_DN_3      
------- GPIO Community 2 -------

PCR Port ID: 0x6b0000

------- GPIO Group CPU -------
0x0600: 0x00003c0040000700 HDACPU_SDI   HDACPU_SDI          
0x0610: 0x00003c0040000700 HDACPU_SDO   HDACPU_SDO          
0x0620: 0x0000000040000700 HDACPU_SCLK  HDACPU_SCLK         
0x0630: 0x0000000040000700 PM_SYNC      PM_SYNC             
0x0640: 0x0000000040000700 PECI         PECI                
0x0650: 0x0000000040000700 CPUPWRGD     CPUPWRGD            
0x0660: 0x0000000040000702 THRMTRIPB    THRMTRIPB           
0x0670: 0x0000000040000700 PLTRST_CPUB  PLTRST_CPUB         
0x0680: 0x0000000040000700 PM_DOWN      PM_DOWN             
0x0690: 0x0000100040000700 TRIGGER_IN   TRIGGER_IN          
0x06a0: 0x0000100040000700 TRIGGER_OUT  TRIGGER_OUT         
0x06b0: 0x0000000040000700 UFS_RESETB   UFS_RESETB          
0x06c0: 0x0000000040000700 CLKOUT_CPURTC CLKOUT_CPURTC       
0x06d0: 0x0000000040000700 VCCST_PWRGD  VCCST_PWRGD         
0x06e0: 0x0000100040000700 C10_WAKE     C10_WAKE            
------- GPIO Group VGPIO_PCIE -------
0x06f0: 0x0000000080000400 VGPIO_PCIE0  VGPIO_PCIE0         
0x0700: 0x0000000080000400 VGPIO_PCIE1  VGPIO_PCIE1         
0x0710: 0x0000000080000400 VGPIO_PCIE2  VGPIO_PCIE2         
0x0720: 0x0000000080000400 VGPIO_PCIE3  VGPIO_PCIE3         
0x0730: 0x0000000080000400 VGPIO_PCIE4  VGPIO_PCIE4         
0x0740: 0x0000000080000400 VGPIO_PCIE5  VGPIO_PCIE5         
0x0750: 0x0000000080000400 VGPIO_PCIE6  VGPIO_PCIE6         
0x0760: 0x0000000080000400 VGPIO_PCIE7  VGPIO_PCIE7         
0x0770: 0x0000000080000400 VGPIO_PCIE8  VGPIO_PCIE8         
0x0780: 0x0000000080000400 VGPIO_PCIE9  VGPIO_PCIE9         
0x0790: 0x0000000080000400 VGPIO_PCIE10 VGPIO_PCIE10        
0x07a0: 0x0000000080000400 VGPIO_PCIE11 VGPIO_PCIE11        
0x07b0: 0x0000000080000400 VGPIO_PCIE12 VGPIO_PCIE12        
0x07c0: 0x0000000080000400 VGPIO_PCIE13 VGPIO_PCIE13        
0x07d0: 0x0000000080000400 VGPIO_PCIE14 VGPIO_PCIE14        
0x07e0: 0x0000000080000400 VGPIO_PCIE15 VGPIO_PCIE15        
0x07f0: 0x0000000080000400 VGPIO_PCIE16 VGPIO_PCIE16        
0x0800: 0x0000000080000400 VGPIO_PCIE17 VGPIO_PCIE17        
0x0810: 0x0000000080000400 VGPIO_PCIE18 VGPIO_PCIE18        
0x0820: 0x0000000080000400 VGPIO_PCIE19 VGPIO_PCIE19        
0x0830: 0x0000000080000400 VGPIO_PCIE20 VGPIO_PCIE20        
0x0840: 0x0000000080000400 VGPIO_PCIE21 VGPIO_PCIE21        
0x0850: 0x0000000080000400 VGPIO_PCIE22 VGPIO_PCIE22        
0x0860: 0x0000000080000400 VGPIO_PCIE23 VGPIO_PCIE23        
0x0870: 0x0000000080000400 VGPIO_PCIE24 VGPIO_PCIE24        
0x0880: 0x0000000080000400 VGPIO_PCIE25 VGPIO_PCIE25        
0x0890: 0x0000000080000400 VGPIO_PCIE26 VGPIO_PCIE26        
0x08a0: 0x0000000080000400 VGPIO_PCIE27 VGPIO_PCIE27        
0x08b0: 0x0000000080000400 VGPIO_PCIE28 VGPIO_PCIE28        
0x08c0: 0x0000000080000400 VGPIO_PCIE29 VGPIO_PCIE29        
0x08d0: 0x0000000080000400 VGPIO_PCIE30 VGPIO_PCIE30        
0x08e0: 0x0000000080000400 VGPIO_PCIE31 VGPIO_PCIE31        
0x08f0: 0x0000000080000400 VGPIO_PCIE32 VGPIO_PCIE32        
0x0900: 0x0000000080000400 VGPIO_PCIE33 VGPIO_PCIE33        
0x0910: 0x0000000080000400 VGPIO_PCIE34 VGPIO_PCIE34        
0x0920: 0x0000000080000400 VGPIO_PCIE35 VGPIO_PCIE35        
0x0930: 0x0000000080000400 VGPIO_PCIE36 VGPIO_PCIE36        
0x0940: 0x0000000080000400 VGPIO_PCIE37 VGPIO_PCIE37        
0x0950: 0x0000000080000400 VGPIO_PCIE38 VGPIO_PCIE38        
0x0960: 0x0000000080000400 VGPIO_PCIE39 VGPIO_PCIE39        
0x0970: 0x0000000080000400 VGPIO_PCIE40 VGPIO_PCIE40        
0x0980: 0x0000000080000400 VGPIO_PCIE41 VGPIO_PCIE41        
0x0990: 0x0000000080000400 VGPIO_PCIE42 VGPIO_PCIE42        
0x09a0: 0x0000000080000400 VGPIO_PCIE43 VGPIO_PCIE43        
0x09b0: 0x0000000080000400 VGPIO_PCIE44 VGPIO_PCIE44        
0x09c0: 0x0000000080000400 VGPIO_PCIE45 VGPIO_PCIE45        
0x09d0: 0x0000000080000400 VGPIO_PCIE46 VGPIO_PCIE46        
0x09e0: 0x0000000080000400 VGPIO_PCIE47 VGPIO_PCIE47        
0x09f0: 0x0000000080000400 VGPIO_PCIE48 VGPIO_PCIE48        
0x0a00: 0x0000000080000400 VGPIO_PCIE49 VGPIO_PCIE49        
0x0a10: 0x0000000080000400 VGPIO_PCIE50 VGPIO_PCIE50        
0x0a20: 0x0000000080000400 VGPIO_PCIE51 VGPIO_PCIE51        
0x0a30: 0x0000000080000400 VGPIO_PCIE52 VGPIO_PCIE52        
0x0a40: 0x0000000080000400 VGPIO_PCIE53 VGPIO_PCIE53        
0x0a50: 0x0000000080000400 VGPIO_PCIE54 VGPIO_PCIE54        
0x0a60: 0x0000000080000400 VGPIO_PCIE55 VGPIO_PCIE55        
0x0a70: 0x0000000080000400 VGPIO_PCIE56 VGPIO_PCIE56        
0x0a80: 0x0000000080000400 VGPIO_PCIE57 VGPIO_PCIE57        
0x0a90: 0x0000000080000400 VGPIO_PCIE58 VGPIO_PCIE58        
0x0aa0: 0x0000000080000400 VGPIO_PCIE59 VGPIO_PCIE59        
0x0ab0: 0x0000000080000400 VGPIO_PCIE60 VGPIO_PCIE60        
0x0ac0: 0x0000000080000400 VGPIO_PCIE61 VGPIO_PCIE61        
0x0ad0: 0x0000000080000400 VGPIO_PCIE62 VGPIO_PCIE62        
0x0ae0: 0x0000000080000400 VGPIO_PCIE63 VGPIO_PCIE63        
0x0af0: 0x0000000080000400 VGPIO_PCIE64 VGPIO_PCIE64        
0x0b00: 0x0000000080000400 VGPIO_PCIE65 VGPIO_PCIE65        
0x0b10: 0x0000000080000400 VGPIO_PCIE66 VGPIO_PCIE66        
0x0b20: 0x0000000080000400 VGPIO_PCIE67 VGPIO_PCIE67        
0x0b30: 0x0000000080000400 VGPIO_PCIE68 VGPIO_PCIE68        
0x0b40: 0x0000000080000400 VGPIO_PCIE69 VGPIO_PCIE69        
0x0b50: 0x0000000080000400 VGPIO_PCIE70 VGPIO_PCIE70        
0x0b60: 0x0000000080000400 VGPIO_PCIE71 VGPIO_PCIE71        
0x0b70: 0x0000000080000400 VGPIO_PCIE72 VGPIO_PCIE72        
0x0b80: 0x0000000080000400 VGPIO_PCIE73 VGPIO_PCIE73        
0x0b90: 0x0000000080000400 VGPIO_PCIE74 VGPIO_PCIE74        
0x0ba0: 0x0000000080000400 VGPIO_PCIE75 VGPIO_PCIE75        
0x0bb0: 0x0000000080000400 VGPIO_PCIE76 VGPIO_PCIE76        
0x0bc0: 0x0000000080000400 VGPIO_PCIE77 VGPIO_PCIE77        
0x0bd0: 0x0000000080000400 VGPIO_PCIE78 VGPIO_PCIE78        
0x0be0: 0x0000000080000400 VGPIO_PCIE79 VGPIO_PCIE79        
------- GPIO Group VGPIO_USB -------
0x0bf0: 0x0000000040000400 VGPIO_USB0   VGPIO_USB0          
0x0c00: 0x0000000040000400 VGPIO_USB1   VGPIO_USB1          
0x0c10: 0x0000000040000400 VGPIO_USB2   VGPIO_USB2          
0x0c20: 0x0000000040000400 VGPIO_USB3   VGPIO_USB3          
0x0c30: 0x0000000040000400 VGPIO_USB4   VGPIO_USB4          
0x0c40: 0x0000000040000400 VGPIO_USB5   VGPIO_USB5          
0x0c50: 0x0000000040000402 VGPIO_USB6   VGPIO_USB6          
0x0c60: 0x0000000040000402 VGPIO_USB7   VGPIO_USB7          
0x0c70: 0x0000000040000402 VGPIO_USB8   VGPIO_USB8          
0x0c80: 0x0000000040000402 VGPIO_USB9   VGPIO_USB9          
0x0c90: 0x0000000040000402 VGPIO_USB10  VGPIO_USB10         
0x0ca0: 0x0000000040000402 VGPIO_USB11  VGPIO_USB11         
------- GPIO Community 3 -------

PCR Port ID: 0x6c0000

------- GPIO Group GPD -------
0x0600: 0x0000006404000702 GPD0         BATLOW#             
0x0610: 0x00003c6504000702 GPD1         PMC_ACPRESENT       
0x0620: 0x0000006640880102 GPD2         GPIO                
0x0630: 0x0000306704000702 GPD3         PWRBTN#             
0x0640: 0x0000006804000600 GPD4         SLP_S3#             
0x0650: 0x0000006904000600 GPD5         SLP_S4#             
0x0660: 0x0000006a04000600 GPD6         SLP_A#              
0x0670: 0x0000006b04000200 GPD7         GPIO                
0x0680: 0x0000006c04000700 GPD8         SUSCLK              
0x0690: 0x0000006d04000600 GPD9         SLP_WLAN#           
0x06a0: 0x0000006e04000600 GPD10        SLP_S5#             
0x06b0: 0x0000000000000700 INPUT3VSEL   INPUT3VSEL          
0x06c0: 0x0000000000000700 SLP_SUS#     SLP_SUS#            
0x06d0: 0x0000000000000702 WAKE#        WAKE#               
0x06e0: 0x0000000000000700 DRAM_RESET#  DRAM_RESET#         
------- GPIO Community 4 -------

PCR Port ID: 0x6d0000

------- GPIO Group GPP_H -------
0x0600: 0x0000007080900102 GPP_H00      GPIO                
0x0610: 0x0000007144000f00 GPP_H01      CNV_RF_RESET_N      
0x0620: 0x0000007244000f00 GPP_H02      MODEM_CLKREQ        
0x0630: 0x0000007344000300 GPP_H03      GPIO                
0x0640: 0x0000007444000300 GPP_H04      GPIO                
0x0650: 0x0000007544000300 GPP_H05      GPIO                
0x0660: 0x0000007680100102 GPP_H06      GPIO                
0x0670: 0x0000007784000201 GPP_H07      GPIO                
0x0680: 0x0000001844000300 GPP_H08      GPIO                
0x0690: 0x0000001944000300 GPP_H09      GPIO                
0x06a0: 0x0000001a44000700 GPP_H10      CPU_C10_GATE_N      
0x06b0: 0x0000001b44000300 GPP_H11      GPIO                
0x06c0: 0x0000001c44000b00 GPP_H12      CNV_RF_RESET_N      
0x06d0: 0x0000001d44000b00 GPP_H13      MODEM_CLKREQ        
0x06e0: 0x0000001e84000102 GPP_H14      GPIO                
0x06f0: 0x0000001f44000300 GPP_H15      GPIO                
0x0700: 0x0000002084000201 GPP_H16      GPIO                
0x0710: 0x0000002144000300 GPP_H17      GPIO                
0x0720: 0x0000002284000201 GPP_H18      GPIO                
0x0730: 0x0000002384000200 GPP_H19      GPIO                
0x0740: 0x0000002444000300 GPP_H20      GPIO                
0x0750: 0x0000002544000300 GPP_H21      GPIO                
0x0760: 0x0000002644000300 GPP_H22      GPIO                
0x0770: 0x0000002744000300 GPP_H23      GPIO                
------- GPIO Group GPP_D -------
0x0780: 0x0000002844000201 GPP_D00      GPIO                
0x0790: 0x0000002944000201 GPP_D01      GPIO                
0x07a0: 0x0000002a80840102 GPP_D02      GPIO                
0x07b0: 0x0000002b84000200 GPP_D03      GPIO                
0x07c0: 0x0000002c84000201 GPP_D04      GPIO                
0x07d0: 0x0000002d84000201 GPP_D05      GPIO                
0x07e0: 0x0000002e44000201 GPP_D06      GPIO                
0x07f0: 0x0000002f44000201 GPP_D07      GPIO                
0x0800: 0x0000003044000300 GPP_D08      GPIO                
0x0810: 0x0000003144000300 GPP_D09      GPIO                
0x0820: 0x0000003244000300 GPP_D10      GPIO                
0x0830: 0x0000003344000300 GPP_D11      GPIO                
0x0840: 0x0000003444000300 GPP_D12      GPIO                
0x0850: 0x0000003544000300 GPP_D13      GPIO                
0x0860: 0x0000003684000200 GPP_D14      GPIO                
0x0870: 0x0000003780900102 GPP_D15      GPIO                
0x0880: 0x0000003840880102 GPP_D16      GPIO                
0x0890: 0x0000003940880102 GPP_D17      GPIO                
0x08a0: 0x0000003a44000300 GPP_D18      GPIO                
0x08b0: 0x0000003b44000300 GPP_D19      GPIO                
0x08c0: 0x0000003c44000300 GPP_D20      GPIO                
0x08d0: 0x0000003d44000300 GPP_D21      GPIO                
0x08e0: 0x0000003e44000300 GPP_D22      GPIO                
0x08f0: 0x0000003f44000300 GPP_D23      GPIO                
0x0900: 0x0000000040000700 GSPI2_CLK_LOOPBK GSPI2_CLK_LOOPBK    
0x0910: 0x0000000040000700 SPI1_CLK_LOOPBK SPI1_CLK_LOOPBK     
------- GPIO Group VGPIO -------
0x0920: 0x0000000040000200 VGPIO0       GPIO                
0x0930: 0x0000000040000003 VGPIO3       GPIO                
0x0940: 0x0000005844000102 VGPIO4       GPIO                
0x0950: 0x0000000040000003 VGPIO5       GPIO                
0x0960: 0x0000000040000402 VGPIO6       VGPIO6              
0x0970: 0x0000000040000400 VGPIO7       VGPIO7              
0x0980: 0x0000000040000400 VGPIO8       VGPIO8              
0x0990: 0x0000000040000402 VGPIO9       VGPIO9              
0x09a0: 0x0000000040000402 VGPIO10      VGPIO10             
0x09b0: 0x0000000040000400 VGPIO11      VGPIO11             
0x09c0: 0x0000000040000400 VGPIO12      VGPIO12             
0x09d0: 0x0000000040000402 VGPIO13      VGPIO13             
0x09e0: 0x0000000040000402 VGPIO18      VGPIO18             
0x09f0: 0x0000000040000400 VGPIO19      VGPIO19             
0x0a00: 0x0000000040000400 VGPIO20      VGPIO20             
0x0a10: 0x0000000040000402 VGPIO21      VGPIO21             
0x0a20: 0x0000000040000402 VGPIO22      VGPIO22             
0x0a30: 0x0000000040000400 VGPIO23      VGPIO23             
0x0a40: 0x0000000040000400 VGPIO24      VGPIO24             
0x0a50: 0x0000000040000402 VGPIO25      VGPIO25             
0x0a60: 0x0000000040000400 VGPIO30      VGPIO30             
0x0a70: 0x0000000040000400 VGPIO31      VGPIO31             
0x0a80: 0x0000000040000400 VGPIO32      VGPIO32             
0x0a90: 0x0000000040000400 VGPIO33      VGPIO33             
0x0aa0: 0x0000000040000400 VGPIO34      VGPIO34             
0x0ab0: 0x0000000040000400 VGPIO35      VGPIO35             
0x0ac0: 0x0000000040000400 VGPIO36      VGPIO36             
0x0ad0: 0x0000000040000400 VGPIO37      VGPIO37             
0x0ae0: 0x0000005944000000 VGPIO39      GPIO                
------- GPIO Group GPP_C -------
0x0af0: 0x0000005a44000300 GPP_C00      GPIO                
0x0b00: 0x0000005b44000300 GPP_C01      GPIO                
0x0b10: 0x0000005c44000300 GPP_C02      GPIO                
0x0b20: 0x0000005d44000102 GPP_C03      GPIO                
0x0b30: 0x0000005e84000201 GPP_C04      GPIO                
0x0b40: 0x0000005f84000201 GPP_C05      GPIO                
0x0b50: 0x0000006044000102 GPP_C06      GPIO                
0x0b60: 0x0000006144000201 GPP_C07      GPIO                
0x0b70: 0x0000006284000201 GPP_C08      GPIO                
0x0b80: 0x0000006384000201 GPP_C09      GPIO                
0x0b90: 0x0000006444000300 GPP_C10      GPIO                
0x0ba0: 0x0000006584000201 GPP_C11      GPIO                
0x0bb0: 0x0000006682900102 GPP_C12      GPIO                
0x0bc0: 0x0000006744000300 GPP_C13      GPIO                
0x0bd0: 0x0000006844000201 GPP_C14      GPIO                
0x0be0: 0x0000006940900102 GPP_C15      GPIO                
0x0bf0: 0x0000006a44000300 GPP_C16      GPIO                
0x0c00: 0x0000006b44000300 GPP_C17      GPIO                
0x0c10: 0x0000006c84000201 GPP_C18      GPIO                
0x0c20: 0x0000006d84000201 GPP_C19      GPIO                
0x0c30: 0x0000006e44000300 GPP_C20      GPIO                
0x0c40: 0x0000006f44000300 GPP_C21      GPIO                
0x0c50: 0x0000007044000300 GPP_C22      GPIO                
0x0c60: 0x0000007144000300 GPP_C23      GPIO                
------- GPIO Community 5 -------

PCR Port ID: 0x6e0000

------- GPIO Group GPP_F -------
0x0600: 0x0000004044000300 GPP_F00      GPIO                
0x0610: 0x0000004144000300 GPP_F01      GPIO                
0x0620: 0x0000004244000300 GPP_F02      GPIO                
0x0630: 0x0000004344000300 GPP_F03      GPIO                
0x0640: 0x0000004440880100 GPP_F04      GPIO                
0x0650: 0x0000004544000300 GPP_F05      GPIO                
0x0660: 0x0000004644000300 GPP_F06      GPIO                
0x0670: 0x0000004744000300 GPP_F07      GPIO                
0x0680: 0x0000004844000300 GPP_F08      GPIO                
0x0690: 0x0000004944000300 GPP_F09      GPIO                
0x06a0: 0x0000004a44000300 GPP_F10      GPIO                
0x06b0: 0x0000004b44000300 GPP_F11      GPIO                
0x06c0: 0x0000004c44000300 GPP_F12      GPIO                
0x06d0: 0x0000004d44000300 GPP_F13      GPIO                
0x06e0: 0x0000004e44000300 GPP_F14      GPIO                
0x06f0: 0x0000004f44000300 GPP_F15      GPIO                
0x0700: 0x0000005044000300 GPP_F16      GPIO                
0x0710: 0x0000005144000300 GPP_F17      GPIO                
0x0720: 0x0000005244000300 GPP_F18      GPIO                
0x0730: 0x0000005344000300 GPP_F19      GPIO                
------- GPIO Group SPI -------
0x0740: 0x00003c0040000700 SPI0_IO_2    SPI0_IO_2           
0x0750: 0x00003c0040000700 SPI0_IO_3    SPI0_IO_3           
0x0760: 0x00003c0040000700 SPI0_MOSI_IO_0 SPI0_MOSI_IO_0      
0x0770: 0x00003c0040000700 SPI0_MISO_IO_0 SPI0_MISO_IO_0      
0x0780: 0x00003c0040000700 SPI0_TPM_CSB SPI0_TPM_CSB        
0x0790: 0x00003c0040000700 SPI0_FLASH_0_CSB SPI0_FLASH_0_CSB    
0x07a0: 0x00003c0040000700 SPI0_FLASH_1_CSB SPI0_FLASH_1_CSB    
0x07b0: 0x00003c0040000700 SPI0_CLK     SPI0_CLK            
0x07c0: 0x0000000040000700 SPI0_CLK_LOOPBK SPI0_CLK_LOOPBK     
------- GPIO Group GPP_B -------
0x07d0: 0x0000002044000700 GPP_B00      PMC_CORE_VID0       
0x07e0: 0x0000002144000700 GPP_B01      PMC_CORE_VID1       
0x07f0: 0x0000002244000300 GPP_B02      GPIO                
0x0800: 0x0000002380900102 GPP_B03      GPIO                
0x0810: 0x0000002484000102 GPP_B04      GPIO                
0x0820: 0x0000002544000300 GPP_B05      GPIO                
0x0830: 0x0000002644000300 GPP_B06      GPIO                
0x0840: 0x0000002744000300 GPP_B07      GPIO                
0x0850: 0x0000002844000300 GPP_B08      GPIO                
0x0860: 0x0000002944000300 GPP_B09      GPIO                
0x0870: 0x0000002a84000201 GPP_B10      GPIO                
0x0880: 0x0000002b04000702 GPP_B11      PMCALERT_N          
0x0890: 0x0000002c44000700 GPP_B12      PMC_SLP_S0_N        
0x08a0: 0x0000002d44000700 GPP_B13      PMC_PLTRST_N        
0x08b0: 0x0000002e44000600 GPP_B14      SPKR                
0x08c0: 0x0000002f40900102 GPP_B15      GPIO                
0x08d0: 0x0000003084000201 GPP_B16      GPIO                
0x08e0: 0x0000003184000201 GPP_B17      GPIO                
0x08f0: 0x0000003284000200 GPP_B18      GPIO                
0x0900: 0x0000003344000300 GPP_B19      GPIO                
0x0910: 0x0000003444000300 GPP_B20      GPIO                
0x0920: 0x0000003544000300 GPP_B21      GPIO                
0x0930: 0x0000003644000200 GPP_B22      GPIO                
0x0940: 0x0000003744000600 GPP_B23      DDI2_HPD            
0x0950: 0x0000000040000700 GSPI0_CLK_LOOPBK GSPI0_CLK_LOOPBK    
0x0960: 0x0000000040000700 GSPI1_CLK_LOOPBK GSPI1_CLK_LOOPBK    
------- GPIO Group GPP_A -------
0x0970: 0x0000303844000700 GPP_A00      ESPI_IO_0           
0x0980: 0x0000303944000702 GPP_A01      ESPI_IO_1           
0x0990: 0x0000303a44000700 GPP_A02      ESPI_IO_2           
0x09a0: 0x0000303b44000700 GPP_A03      ESPI_IO_3           
0x09b0: 0x0000303c44000700 GPP_A04      ESPI_CS_N           
0x09c0: 0x0000103d44000700 GPP_A05      ESPI_CLK            
0x09d0: 0x0000003e44000700 GPP_A06      ESPI_RESET_N        
0x09e0: 0x0000003f44000702 GPP_A07      SMB_CLK             
0x09f0: 0x0000004044000702 GPP_A08      SMB_DATA            
0x0a00: 0x0000004144000201 GPP_A09      GPIO                
0x0a10: 0x0000004244000300 GPP_A10      GPIO                
0x0a20: 0x0000004384000200 GPP_A11      GPIO                
0x0a30: 0x0000004484000201 GPP_A12      GPIO                
0x0a40: 0x0000004544000702 GPP_A13      USB_OC2_N           
0x0a50: 0x0000004644000702 GPP_A14      USB_OC3_N           
0x0a60: 0x0000004744000200 GPP_A15      GPIO                
0x0a70: 0x0000004844000702 GPP_A16      DDI1_HPD            
0x0a80: 0x0000004944000700 GPP_A17      DDI0_HPD            
0x0a90: 0x0000004a44000702 GPP_A18      USB_OC0_N           
0x0aa0: 0x0000004b84000201 GPP_A19      GPIO                
0x0ab0: 0x0000000040000700 ESPI_CLK_LOOPBK ESPI_CLK_LOOPBK     
------- GPIO Group GPP_S -------
0x0ac0: 0x0180005c44000300 GPP_S00      GPIO                
0x0ad0: 0x0180005d84000201 GPP_S01      GPIO                
0x0ae0: 0x0180005e44000b00 GPP_S02      DMIC_CLK_1          
0x0af0: 0x0180005f44000b00 GPP_S03      DMIC_DATA_1         
0x0b00: 0x0180006044000300 GPP_S04      GPIO                
0x0b10: 0x0180006144000300 GPP_S05      GPIO                
0x0b20: 0x0180006244000b00 GPP_S06      DMIC_CLK_0          
0x0b30: 0x0180006344000b00 GPP_S07      DMIC_DATA_0         
------- GPIO Group GPP_R -------
0x0b40: 0x0000005044000700 GPP_R00      HDA_BCLK            
0x0b50: 0x00003c5144000700 GPP_R01      HDA_SYNC            
0x0b60: 0x00003c5244000600 GPP_R02      HDA_SDO             
0x0b70: 0x00003c5344000700 GPP_R03      HDA_SDI0            
0x0b80: 0x0000005444000700 GPP_R04      HDA_RST_N           
0x0b90: 0x0000005544000300 GPP_R05      GPIO                
0x0ba0: 0x0000005644000300 GPP_R06      GPIO                
0x0bb0: 0x0000005744000300 GPP_R07      GPIO                


