lspci -vvv
00:00.0 Host bridge: Intel Corporation Device 4e24
        DeviceName: Onboard - Other
        Subsystem: Intel Corporation Device 7270
        Control: I/O- Mem+ BusMaster+ SpecCycle- MemWINV- VGASnoop- ParErr- Stepping- SERR- FastB2B- DisINTx-
        Status: Cap+ 66MHz- UDF- FastB2B+ ParErr- DEVSEL=fast >TAbort- <TAbort- <MAbort+ >SERR- <PERR- INTx-
        Latency: 0
        IOMMU group: 1
        Capabilities: <access denied>

00:02.0 VGA compatible controller: Intel Corporation JasperLake [UHD Graphics] (rev 01) (prog-if 00 [VGA controller])
        DeviceName: Onboard - Video
        Subsystem: Intel Corporation Device 2212
        Control: I/O+ Mem+ BusMaster+ SpecCycle- MemWINV- VGASnoop- ParErr- Stepping- SERR- FastB2B- DisINTx+
        Status: Cap+ 66MHz- UDF- FastB2B- ParErr- DEVSEL=fast >TAbort- <TAbort- <MAbort- >SERR- <PERR- INTx-
        Latency: 0, Cache Line Size: 64 bytes
        Interrupt: pin A routed to IRQ 158
        IOMMU group: 0
        Region 0: Memory at 6000000000 (64-bit, non-prefetchable) [size=16M]
        Region 2: Memory at 4000000000 (64-bit, prefetchable) [size=256M]
        Region 4: I/O ports at 3000 [size=64]
        Expansion ROM at 000c0000 [virtual] [disabled] [size=128K]
        Capabilities: <access denied>
        Kernel driver in use: i915
        Kernel modules: i915

00:04.0 Signal processing controller: Intel Corporation Dynamic Tuning service
        DeviceName: Onboard - Other
        Subsystem: Intel Corporation Device 7270
        Control: I/O- Mem+ BusMaster- SpecCycle- MemWINV- VGASnoop- ParErr- Stepping- SERR- FastB2B- DisINTx-
        Status: Cap+ 66MHz- UDF- FastB2B+ ParErr- DEVSEL=fast >TAbort- <TAbort- <MAbort- >SERR- <PERR- INTx-
        Interrupt: pin A routed to IRQ 16
        IOMMU group: 2
        Region 0: Memory at 6001110000 (64-bit, non-prefetchable) [size=64K]
        Capabilities: <access denied>
        Kernel modules: processor_thermal_device_pci_legacy

00:14.0 USB controller: Intel Corporation Jasper Lake USB 3.1 xHCI Host Controller (rev 01) (prog-if 30 [XHCI])
        DeviceName: Onboard - Other
        Subsystem: Intel Corporation Device 7270
        Control: I/O- Mem+ BusMaster+ SpecCycle- MemWINV- VGASnoop- ParErr- Stepping- SERR- FastB2B- DisINTx+
        Status: Cap+ 66MHz- UDF- FastB2B+ ParErr- DEVSEL=medium >TAbort- <TAbort- <MAbort- >SERR- <PERR- INTx-
        Latency: 0
        Interrupt: pin A routed to IRQ 127
        IOMMU group: 3
        Region 0: Memory at 6001100000 (64-bit, non-prefetchable) [size=64K]
        Capabilities: <access denied>
        Kernel driver in use: xhci_hcd
        Kernel modules: xhci_pci

00:14.2 RAM memory: Intel Corporation Jasper Lake Shared SRAM (rev 01)
        DeviceName: Onboard - Other
        Subsystem: Intel Corporation Device 7270
        Control: I/O- Mem- BusMaster- SpecCycle- MemWINV- VGASnoop- ParErr- Stepping- SERR- FastB2B- DisINTx-
        Status: Cap+ 66MHz- UDF- FastB2B- ParErr- DEVSEL=fast >TAbort- <TAbort- <MAbort- >SERR- <PERR- INTx-
        IOMMU group: 3
        Region 0: Memory at 6001124000 (64-bit, non-prefetchable) [disabled] [size=8K]
        Region 2: Memory at 6001128000 (64-bit, non-prefetchable) [disabled] [size=4K]
        Capabilities: <access denied>

00:16.0 Communication controller: Intel Corporation Management Engine Interface (rev 01)
        DeviceName: Onboard - Other
        Subsystem: Intel Corporation Device 7270
        Control: I/O- Mem+ BusMaster+ SpecCycle- MemWINV- VGASnoop- ParErr- Stepping- SERR- FastB2B- DisINTx+
        Status: Cap+ 66MHz- UDF- FastB2B- ParErr- DEVSEL=fast >TAbort- <TAbort- <MAbort- >SERR- <PERR- INTx-
        Latency: 0
        Interrupt: pin A routed to IRQ 159
        IOMMU group: 4
        Region 0: Memory at 6001127000 (64-bit, non-prefetchable) [size=4K]
        Capabilities: <access denied>
        Kernel driver in use: mei_me
        Kernel modules: mei_me

00:17.0 SATA controller: Intel Corporation Jasper Lake SATA AHCI Controller (rev 01) (prog-if 01 [AHCI 1.0])
        DeviceName: Onboard - SATA
        Subsystem: Intel Corporation Device 7270
        Control: I/O+ Mem+ BusMaster+ SpecCycle- MemWINV- VGASnoop- ParErr- Stepping- SERR- FastB2B- DisINTx+
        Status: Cap+ 66MHz+ UDF- FastB2B+ ParErr- DEVSEL=medium >TAbort- <TAbort- <MAbort- >SERR- <PERR- INTx-
        Latency: 0
        Interrupt: pin A routed to IRQ 137
        IOMMU group: 5
        Region 0: Memory at 80500000 (32-bit, non-prefetchable) [size=8K]
        Region 1: Memory at 80503000 (32-bit, non-prefetchable) [size=256]
        Region 2: I/O ports at 3090 [size=8]
        Region 3: I/O ports at 3080 [size=4]
        Region 4: I/O ports at 3060 [size=32]
        Region 5: Memory at 80502000 (32-bit, non-prefetchable) [size=2K]
        Capabilities: <access denied>
        Kernel driver in use: ahci
        Kernel modules: ahci

00:1c.0 PCI bridge: Intel Corporation Jasper Lake PCIe Root Port #1 (rev 01) (prog-if 00 [Normal decode])
        Subsystem: Intel Corporation Device 7270
        Control: I/O+ Mem+ BusMaster+ SpecCycle- MemWINV- VGASnoop- ParErr- Stepping- SERR- FastB2B- DisINTx+
        Status: Cap+ 66MHz- UDF- FastB2B- ParErr- DEVSEL=fast >TAbort- <TAbort- <MAbort- >SERR- <PERR- INTx-
        Latency: 0, Cache Line Size: 64 bytes
        Interrupt: pin A routed to IRQ 122
        IOMMU group: 6
        Bus: primary=00, secondary=01, subordinate=01, sec-latency=0
        I/O behind bridge: f000-0fff [disabled] [16-bit]
        Memory behind bridge: 80400000-804fffff [size=1M] [32-bit]
        Prefetchable memory behind bridge: 00000000fff00000-00000000000fffff [disabled] [64-bit]
        Secondary status: 66MHz- FastB2B- ParErr- DEVSEL=fast >TAbort- <TAbort- <MAbort- <SERR- <PERR-
        BridgeCtl: Parity- SERR+ NoISA- VGA- VGA16+ MAbort- >Reset- FastB2B-
                PriDiscTmr- SecDiscTmr- DiscTmrStat- DiscTmrSERREn-
        Capabilities: <access denied>
        Kernel driver in use: pcieport

00:1c.4 PCI bridge: Intel Corporation Jasper Lake PCIe Root Port #5 (rev 01) (prog-if 00 [Normal decode])
        Subsystem: Intel Corporation Device 7270
        Control: I/O+ Mem+ BusMaster+ SpecCycle- MemWINV- VGASnoop- ParErr- Stepping- SERR- FastB2B- DisINTx+
        Status: Cap+ 66MHz- UDF- FastB2B- ParErr- DEVSEL=fast >TAbort- <TAbort- <MAbort- >SERR- <PERR- INTx-
        Latency: 0, Cache Line Size: 64 bytes
        Interrupt: pin A routed to IRQ 123
        IOMMU group: 7
        Bus: primary=00, secondary=02, subordinate=02, sec-latency=0
        I/O behind bridge: f000-0fff [disabled] [16-bit]
        Memory behind bridge: 80200000-803fffff [size=2M] [32-bit]
        Prefetchable memory behind bridge: 00000000fff00000-00000000000fffff [disabled] [64-bit]
        Secondary status: 66MHz- FastB2B- ParErr- DEVSEL=fast >TAbort- <TAbort- <MAbort- <SERR- <PERR-
        BridgeCtl: Parity- SERR+ NoISA- VGA- VGA16+ MAbort- >Reset- FastB2B-
                PriDiscTmr- SecDiscTmr- DiscTmrStat- DiscTmrSERREn-
        Capabilities: <access denied>
        Kernel driver in use: pcieport

00:1c.5 PCI bridge: Intel Corporation Device 4dbd (rev 01) (prog-if 00 [Normal decode])
        Subsystem: Intel Corporation Device 7270
        Control: I/O+ Mem+ BusMaster+ SpecCycle- MemWINV- VGASnoop- ParErr- Stepping- SERR- FastB2B- DisINTx+
        Status: Cap+ 66MHz- UDF- FastB2B- ParErr- DEVSEL=fast >TAbort- <TAbort- <MAbort- >SERR- <PERR- INTx-
        Latency: 0, Cache Line Size: 64 bytes
        Interrupt: pin B routed to IRQ 124
        IOMMU group: 8
        Bus: primary=00, secondary=03, subordinate=03, sec-latency=0
        I/O behind bridge: f000-0fff [disabled] [16-bit]
        Memory behind bridge: 80000000-801fffff [size=2M] [32-bit]
        Prefetchable memory behind bridge: 00000000fff00000-00000000000fffff [disabled] [64-bit]
        Secondary status: 66MHz- FastB2B- ParErr- DEVSEL=fast >TAbort- <TAbort- <MAbort- <SERR- <PERR-
        BridgeCtl: Parity- SERR+ NoISA- VGA- VGA16+ MAbort- >Reset- FastB2B-
                PriDiscTmr- SecDiscTmr- DiscTmrStat- DiscTmrSERREn-
        Capabilities: <access denied>
        Kernel driver in use: pcieport

00:1c.6 PCI bridge: Intel Corporation Jasper Lake PCIe Root Port #7 (rev 01) (prog-if 00 [Normal decode])
        Subsystem: Intel Corporation Device 7270
        Control: I/O+ Mem+ BusMaster+ SpecCycle- MemWINV- VGASnoop- ParErr- Stepping- SERR- FastB2B- DisINTx+
        Status: Cap+ 66MHz- UDF- FastB2B- ParErr- DEVSEL=fast >TAbort- <TAbort- <MAbort- >SERR- <PERR- INTx-
        Latency: 0, Cache Line Size: 64 bytes
        Interrupt: pin C routed to IRQ 125
        IOMMU group: 9
        Bus: primary=00, secondary=04, subordinate=04, sec-latency=0
        I/O behind bridge: f000-0fff [disabled] [16-bit]
        Memory behind bridge: 7fe00000-7fffffff [size=2M] [32-bit]
        Prefetchable memory behind bridge: 00000000fff00000-00000000000fffff [disabled] [64-bit]
        Secondary status: 66MHz- FastB2B- ParErr- DEVSEL=fast >TAbort- <TAbort- <MAbort- <SERR- <PERR-
        BridgeCtl: Parity- SERR+ NoISA- VGA- VGA16+ MAbort- >Reset- FastB2B-
                PriDiscTmr- SecDiscTmr- DiscTmrStat- DiscTmrSERREn-
        Capabilities: <access denied>
        Kernel driver in use: pcieport

00:1c.7 PCI bridge: Intel Corporation Device 4dbf (rev 01) (prog-if 00 [Normal decode])
        Subsystem: Intel Corporation Device 7270
        Control: I/O+ Mem+ BusMaster+ SpecCycle- MemWINV- VGASnoop- ParErr- Stepping- SERR- FastB2B- DisINTx+
        Status: Cap+ 66MHz- UDF- FastB2B- ParErr- DEVSEL=fast >TAbort- <TAbort- <MAbort- >SERR- <PERR- INTx-
        Latency: 0, Cache Line Size: 64 bytes
        Interrupt: pin D routed to IRQ 126
        IOMMU group: 10
        Bus: primary=00, secondary=05, subordinate=05, sec-latency=0
        I/O behind bridge: f000-0fff [disabled] [16-bit]
        Memory behind bridge: 7fc00000-7fdfffff [size=2M] [32-bit]
        Prefetchable memory behind bridge: 00000000fff00000-00000000000fffff [disabled] [64-bit]
        Secondary status: 66MHz- FastB2B- ParErr- DEVSEL=fast >TAbort- <TAbort- <MAbort- <SERR- <PERR-
        BridgeCtl: Parity- SERR+ NoISA- VGA- VGA16+ MAbort- >Reset- FastB2B-
                PriDiscTmr- SecDiscTmr- DiscTmrStat- DiscTmrSERREn-
        Capabilities: <access denied>
        Kernel driver in use: pcieport

00:1f.0 ISA bridge: Intel Corporation Jasper Lake eSPI Controller (rev 01)
        DeviceName: Onboard - Other
        Subsystem: Intel Corporation Device 7270
        Control: I/O+ Mem+ BusMaster+ SpecCycle- MemWINV- VGASnoop- ParErr- Stepping- SERR- FastB2B- DisINTx+
        Status: Cap- 66MHz- UDF- FastB2B- ParErr- DEVSEL=fast >TAbort- <TAbort- <MAbort- >SERR- <PERR- INTx-
        Latency: 0
        IOMMU group: 11

00:1f.3 Audio device: Intel Corporation Jasper Lake HD Audio (rev 01)
        DeviceName: Onboard - Sound
        Subsystem: Intel Corporation Device 7270
        Control: I/O- Mem+ BusMaster+ SpecCycle- MemWINV- VGASnoop- ParErr- Stepping- SERR- FastB2B- DisINTx+
        Status: Cap+ 66MHz- UDF- FastB2B- ParErr- DEVSEL=fast >TAbort- <TAbort- <MAbort- >SERR- <PERR- INTx-
        Latency: 32, Cache Line Size: 64 bytes
        Interrupt: pin A routed to IRQ 160
        IOMMU group: 11
        Region 0: Memory at 6001120000 (64-bit, non-prefetchable) [size=16K]
        Region 4: Memory at 6001000000 (64-bit, non-prefetchable) [size=1M]
        Capabilities: <access denied>
        Kernel driver in use: snd_hda_intel
        Kernel modules: snd_hda_intel, snd_soc_avs, snd_sof_pci_intel_icl

00:1f.4 SMBus: Intel Corporation Jasper Lake SMBus (rev 01)
        DeviceName: Onboard - Other
        Subsystem: Intel Corporation Device 7270
        Control: I/O+ Mem+ BusMaster- SpecCycle- MemWINV- VGASnoop- ParErr- Stepping- SERR- FastB2B- DisINTx-
        Status: Cap- 66MHz- UDF- FastB2B+ ParErr- DEVSEL=medium >TAbort- <TAbort- <MAbort- >SERR- <PERR- INTx-
        Interrupt: pin A routed to IRQ 16
        IOMMU group: 11
        Region 0: Memory at 6001126000 (64-bit, non-prefetchable) [size=256]
        Region 4: I/O ports at efa0 [size=32]
        Kernel driver in use: i801_smbus
        Kernel modules: i2c_i801

00:1f.5 Serial bus controller: Intel Corporation Jasper Lake SPI Controller (rev 01)
        DeviceName: Onboard - Other
        Subsystem: Intel Corporation Device 7270
        Control: I/O- Mem+ BusMaster- SpecCycle- MemWINV- VGASnoop- ParErr- Stepping- SERR- FastB2B- DisINTx+
        Status: Cap- 66MHz- UDF- FastB2B- ParErr- DEVSEL=fast >TAbort- <TAbort- <MAbort- >SERR- <PERR- INTx-
        IOMMU group: 11
        Region 0: Memory at 80504000 (32-bit, non-prefetchable) [size=4K]

01:00.0 Non-Volatile memory controller: Samsung Electronics Co Ltd NVMe SSD Controller 980 (DRAM-less) (prog-if 02 [NVM Express])
        Subsystem: Samsung Electronics Co Ltd Device a801
        Control: I/O- Mem+ BusMaster+ SpecCycle- MemWINV- VGASnoop- ParErr- Stepping- SERR- FastB2B- DisINTx+
        Status: Cap+ 66MHz- UDF- FastB2B- ParErr- DEVSEL=fast >TAbort- <TAbort- <MAbort- >SERR- <PERR- INTx-
        Latency: 0, Cache Line Size: 64 bytes
        Interrupt: pin A routed to IRQ 16
        IOMMU group: 12
        Region 0: Memory at 80400000 (64-bit, non-prefetchable) [size=16K]
        Capabilities: <access denied>
        Kernel driver in use: nvme
        Kernel modules: nvme

02:00.0 Ethernet controller: Intel Corporation Ethernet Controller I226-V (rev 04)
        Subsystem: Intel Corporation Device 0000
        Control: I/O- Mem+ BusMaster+ SpecCycle- MemWINV- VGASnoop- ParErr- Stepping- SERR- FastB2B- DisINTx+
        Status: Cap+ 66MHz- UDF- FastB2B- ParErr- DEVSEL=fast >TAbort- <TAbort- <MAbort- >SERR- <PERR- INTx-
        Latency: 0, Cache Line Size: 64 bytes
        Interrupt: pin A routed to IRQ 16
        IOMMU group: 13
        Region 0: Memory at 80200000 (32-bit, non-prefetchable) [size=1M]
        Region 3: Memory at 80300000 (32-bit, non-prefetchable) [size=16K]
        Capabilities: <access denied>
        Kernel driver in use: igc
        Kernel modules: igc

03:00.0 Ethernet controller: Intel Corporation Ethernet Controller I226-V (rev 04)
        Subsystem: Intel Corporation Device 0000
        Control: I/O- Mem+ BusMaster+ SpecCycle- MemWINV- VGASnoop- ParErr- Stepping- SERR- FastB2B- DisINTx+
        Status: Cap+ 66MHz- UDF- FastB2B- ParErr- DEVSEL=fast >TAbort- <TAbort- <MAbort- >SERR- <PERR- INTx-
        Latency: 0, Cache Line Size: 64 bytes
        Interrupt: pin A routed to IRQ 17
        IOMMU group: 14
        Region 0: Memory at 80000000 (32-bit, non-prefetchable) [size=1M]
        Region 3: Memory at 80100000 (32-bit, non-prefetchable) [size=16K]
        Capabilities: <access denied>
        Kernel driver in use: igc
        Kernel modules: igc

04:00.0 Ethernet controller: Intel Corporation Ethernet Controller I226-V (rev 04)
        Subsystem: Intel Corporation Device 0000
        Control: I/O- Mem+ BusMaster+ SpecCycle- MemWINV- VGASnoop- ParErr- Stepping- SERR- FastB2B- DisINTx+
        Status: Cap+ 66MHz- UDF- FastB2B- ParErr- DEVSEL=fast >TAbort- <TAbort- <MAbort- >SERR- <PERR- INTx-
        Latency: 0, Cache Line Size: 64 bytes
        Interrupt: pin A routed to IRQ 18
        IOMMU group: 15
        Region 0: Memory at 7fe00000 (32-bit, non-prefetchable) [size=1M]
        Region 3: Memory at 7ff00000 (32-bit, non-prefetchable) [size=16K]
        Capabilities: <access denied>
        Kernel driver in use: igc
        Kernel modules: igc

05:00.0 Ethernet controller: Intel Corporation Ethernet Controller I226-V (rev 04)
        Subsystem: Intel Corporation Device 0000
        Control: I/O- Mem+ BusMaster+ SpecCycle- MemWINV- VGASnoop- ParErr- Stepping- SERR- FastB2B- DisINTx+
        Status: Cap+ 66MHz- UDF- FastB2B- ParErr- DEVSEL=fast >TAbort- <TAbort- <MAbort- >SERR- <PERR- INTx-
        Latency: 0, Cache Line Size: 64 bytes
        Interrupt: pin A routed to IRQ 19
        IOMMU group: 16
        Region 0: Memory at 7fc00000 (32-bit, non-prefetchable) [size=1M]
        Region 3: Memory at 7fd00000 (32-bit, non-prefetchable) [size=16K]
        Capabilities: <access denied>
        Kernel driver in use: igc
        Kernel modules: igc
